{
  "$schema": "https://json-schema.org/draft/2020-12/schema",
  "$id": "urn:tsheet:meta:workbook:0.1",
  "title": "tsheet形式 マニフェスト v0.1",
  "type": "object",
  "required": [
    "specVersion",
    "schema",
    "data",
    "views",
    "docsDir",
    "dataSchemaVersion"
  ],
  "properties": {
    "$schema": {
      "type": "string"
    },
    "specVersion": {
      "const": "0.1"
    },
    "schema": {
      "type": "string"
    },
    "data": {
      "type": "string"
    },
    "views": {
      "type": "array",
      "items": {
        "type": "string"
      }
    },
    "marks": {
      "type": "array",
      "items": {
        "type": "string"
      }
    },
    "docsDir": {
      "type": "string"
    },
    "dataSchemaVersion": {
      "type": "integer",
      "minimum": 1
    },
    "settings": {
      "type": "object",
      "properties": {
        "fiscalYearStart": {
          "type": "integer",
          "minimum": 1,
          "maximum": 12,
          "default": 1,
          "description": "会計年度の開始月"
        },
        "fiscalYearLabel": {
          "enum": [
            "start",
            "end"
          ],
          "default": "start",
          "description": "FY の年号を開始年・終了年のどちらで表すか"
        },
        "weekStart": {
          "enum": [
            "mon",
            "sun"
          ],
          "default": "mon"
        },
        "timezone": {
          "type": "string",
          "description": "IANA タイムゾーン名。TODAY() の基準"
        },
        "privacy": {
          "type": "object",
          "properties": {
            "recordActors": {
              "type": "boolean",
              "default": true,
              "description": "createdBy / updatedBy を記録するか。false で保存時に既存の値も除去する（本体仕様 §2.5）"
            }
          },
          "additionalProperties": false
        }
      },
      "additionalProperties": false
    },
    "params": {
      "type": "object",
      "propertyNames": {
        "pattern": "^[a-z][A-Za-z0-9_]{0,63}$"
      },
      "description": "schema.root.fields の値。未設定と null を区別する"
    }
  },
  "additionalProperties": false
}
