{
  "$schema": "../../meta/workbook.v0.1.json",
  "specVersion": "0.1",
  "schema": "schema.json",
  "data": "data.jsonl",
  "views": [
    "views/default.view.json",
    "views/entries.view.json",
    "views/quarterly.view.json"
  ],
  "docsDir": "docs",
  "dataSchemaVersion": 1,
  "settings": {
    "fiscalYearStart": 4
  },
  "params": {
    "fiscalYear": 2026,
    "currentMonth": "2026-09"
  }
}
